{
  "$id": "https://schemas.sswg.local/environment-lock.json#",
  "$schema": "https://json-schema.org/draft/2020-12/schema",
  "title": "sswg environment lock",
  "type": "object",
  "additionalProperties": false,
  "required": ["anchor", "runtime", "dependencies"],
  "properties": {
    "anchor": {
      "type": "object",
      "additionalProperties": false,
      "required": ["anchor_id", "anchor_version", "scope", "owner", "status"],
      "properties": {
        "anchor_id": { "type": "string" },
        "anchor_version": { "type": "string" },
        "scope": { "type": "string" },
        "owner": { "type": "string" },
        "status": {
          "type": "string",
          "enum": ["draft", "sandbox", "canonical", "archived"]
        }
      }
    },
    "runtime": {
      "type": "object",
      "additionalProperties": false,
      "required": ["python_version"],
      "properties": {
        "python_version": { "type": "string" }
      }
    },
    "dependencies": {
      "type": "array",
      "minItems": 1,
      "items": {
        "type": "object",
        "additionalProperties": false,
        "required": ["name", "version"],
        "properties": {
          "name": { "type": "string" },
          "version": { "type": "string" },
          "hash": { "type": "string" }
        }
      }
    },
    "notes": { "type": "string" }
  }
}
